{
  "requestId": "12345678-1234-1234-1234-123456789abc",
  "templateHash": "4458377bcee0af034d50f4cee0de424e0f0f27ebb93a3af40adede27a3656567",
  "width": 100,
  "height": 80,
  "viewBox": [
    0,
    0,
    100,
    80
  ],
  "layerIds": [],
  "segmentCount": 5,
  "engineVersion": "0.1.0",
  "rulesVersion": "1"
}
